{
  "name": "engineering-discovery",
  "version": "0.1.0-dev.0",
  "description": "Evidence-backed engineering decisions before implementation",
  "author": {
    "name": "RJChristofoli",
    "url": "https://github.com/RJChristofoli"
  },
  "homepage": "https://github.com/RJChristofoli/men-of-letters",
  "repository": "https://github.com/RJChristofoli/men-of-letters",
  "license": "Apache-2.0",
  "keywords": ["engineering", "architecture", "discovery", "decisions"],
  "skills": "./skills/",
  "interface": {
    "displayName": "Engineering Discovery",
    "shortDescription": "Compare engineering options before implementation",
    "longDescription": "Build an evidence-backed decision proposal with alternatives, trade-offs, risks, and a reversible validation experiment before implementation begins.",
    "developerName": "RJChristofoli",
    "category": "Productivity",
    "capabilities": ["Engineering discovery", "Architecture decisions"],
    "defaultPrompt": [
      "Compare architecture options for this feature.",
      "Recommend a reversible technology experiment."
    ]
  }
}
