{
  "name": "men-of-letters",
  "version": "0.1.0",
  "description": "Focused engineering skills for analysis, implementation, debugging, review, and research",
  "author": {
    "name": "RJChristofoli",
    "url": "https://github.com/RJChristofoli"
  },
  "homepage": "https://github.com/RJChristofoli/men-of-letters",
  "repository": "https://github.com/RJChristofoli/men-of-letters",
  "license": "Apache-2.0",
  "keywords": ["engineering", "implementation", "debugging", "review", "research"],
  "skills": "./skills/",
  "interface": {
    "displayName": "Men of Letters",
    "shortDescription": "Practical skills for software development",
    "longDescription": "A small set of focused workflows for technical analysis, implementation, debugging, code review, and engineering research.",
    "developerName": "RJChristofoli",
    "category": "Productivity",
    "capabilities": ["Analysis", "Implementation", "Debugging", "Code review", "Research"],
    "defaultPrompt": [
      "Analyze this technical problem before implementation.",
      "Implement this change and verify the result.",
      "Review this change for bugs and regressions."
    ]
  }
}
